{"schema_version":"governance/v1","failure_id":"failure-synthetic-001","lifecycle_id":"lifecycle-synthetic-001","phase":"PRECONDITION","failure_class":"PRECONDITION_FAILED","reason_codes":["PRECONDITION_DRIFT"],"authorization_state":"STALE","claim_consumed":false,"actual_invocation_count":0,"completed_count":0,"uncertain_count":0,"retry_prohibited":true,"rollback_prohibited":true,"manual_action_required":false,"occurred_at":"2026-08-10T00:03:00+00:00"}
